Classification,Summary
1,recurrent cutaneous cell non hodgkin lymphoma diagnosis and measurable and or evaluable disease per lugano classification
0,ovarian cancer diagnosis and subject with an old infection that has cleared may be included
0,recurrent gastric cancer diagnosis and severely impaired lung function as defined as spirometry and diffusion lung capacity of carbon monoxide dlco that is fifty of the normal predicted value and or two saturation that is eighty-eight or less at rest on room air
0,stage iva colon cancer diagnosis and prior treatment with sorafenib is not allowed
0,biliary tract neoplasms diagnosis and the presence of any severe concomitant disease that could interrupt the planned treatment
0,John's Wort
0,recurrent colon cancer diagnosis and patients with known allergy to cremaphor or cremophor based drug products
1,brain and central nervous system tumors diagnosis and concurrent steroid dosage must be stable
1,mantle cell lymphoma meeting one of the following criteria
1,stage iiic breast cancer diagnosis and the patient must have completed one of the procedures for evaluation of pathologic nodal status listed below
0,colorectal neoplasms diagnosis and patient immediately eligible for curative therapy surgical and or percutaneous after discussion in cpr
0,multiple myeloma diagnosis and if neither prior myeloablative autologous transplant less_than twelve months from transplant nor have received at least two cycles of multi agent or highly immunosuppressive chemotherapy induction for acute leukemia within the three months preceding this study patients are eligible as long as they receive equine anti thymocyte_globulin as part of the conditioning regimen
1,recurrent colon cancer diagnosis and patients must have histologically proven hertwo overexpressing malignancy as determined by any standardized assay currently in clinical use
0,ovarian serous tumor diagnosis and significant acute or chronic medical neurologic or psychiatric illness in the subject that in the judgment of the investigator could compromise subject safety limit the subject ability to complete the study and or compromise the objectives of the study
1,histology proven unresectable hepatocellular carcinoma
0,bladder cancer diagnosis and use of strong cypthreeafour inhibitors or inducers is prohibited on study
0,oral cavity squamous cell carcinoma diagnosis and patients who receive rt or crt with palliative intent and have prognosis of less than one year survival
1,esophageal cancer diagnosis and no grade two or greater peripheral neuropathy
0,stage ib esophageal adenocarcinoma diagnosis and patients with history of allergic reactions attributed to compounds of similar chemical or biologic composition to platinums taxanes or fluoropyrimidines
0,recurrent childhood visual pathway glioma diagnosis and hemoglobin greater_than equal_than eight dl may receive transfusions
0,mature cell and nk cell non hodgkin lymphoma diagnosis and pregnant women are excluded from this study breastfeeding should be discontinued if the mother is treated with mlneight thousand
0,stage iiia breast cancer diagnosis and daily use of three pufa concentrates or capsules or regular or any other supplements that might interact with three pufa supplements within six months of study initiation sporadic use of three pufa supplement may be eligible if there has been three month washout period prior to randomization
0,cancer pain diagnosis and participation in other research projects that are in conflict or could confound the results of the study
0,stage ii breast cancer diagnosis and myocardial infarction documented as clinical diagnosis or by ekg or any other test
0,recurrent childhood lymphoblastic lymphoma diagnosis and patient has the following organ dysfunction
0,exposure to any prior chemotherapy steroid use or other myeloma treatment within fourteen days prior to first dose
1,stage ivb colon cancer diagnosis and ast sgot alt sgpt equal_than less_than doc institutional upper limit of normal equal_than less_than five institutional upper limit of normal for patients with liver metastatsis
1,sarcoma diagnosis and not specified radiotherapy
0,recurrent squamous cell carcinoma of the oropharynx diagnosis and for subjects assigned to take vorinostat inability to take oral medications vorinostat capsules must be administered whole note
0,childhood non hodgkin lymphoma diagnosis and patients with poorly controlled hypertension on multiple antihypertensives
0,bone neoplasms diagnosis and reconstruction to include allograft
0,relapsed solid tumors diagnosis and patients who are currently taking rifampin voriconazole itraconazole ketoconazole aprepitant or st
0,neoplasms diagnosis and marked baseline prolongation of qt qtc interval repeated demonstration of qtc interval greater_than four hundred and fifty msec long qt syndrome the required use of concomitant medication that may cause torsades de pointes
0,b cell lymphoma diagnosis and prior chemotherapy or radiotherapy within four weeks
0,myeloma diagnosis and inability to sign consent
0,stage iia colon cancer diagnosis and history of tia or cva
1,recurrent adult lymphoblastic lymphoma diagnosis and md negative intermediate two or high ipss score
0,bladder neoplasms diagnosis and iodine allergy
1,stage ovarian cancer diagnosis and patients must have recovered from the effects of recent surgery radiotherapy or other therapy
0,patients who transformed follicular lymphoma or other indolent lymphoma
0,recurrent bladder cancer diagnosis and pregnant women are excluded from this study breastfeeding should be discontinued if the mother is treated with bay_forty-three nine thousand and six
0,recurrent fallopian tube carcinoma diagnosis and evidence of bleeding diathesis or clinically significant coagulopathy
1,lymphoma diagnosis and not pregnant or nursing
0,recurrent thyroid gland carcinoma diagnosis and patients with one positive or greater proteinuria on urinalysis should collect twenty-four hour urine collection patients with greater than doc gram protein twenty-four hours are excluded
1,stage iv gallbladder cancer diagnosis and arm cohort one
0,recurrent adult immunoblastic large cell lymphoma diagnosis and diffusion capacity of the lung for carbon monoxide dlco less_than thirty-five total lung capacity tlc less_than thirty-five forced expiratory volume of the lung in one second fevone less_than thirty-five and or receiving supplementary continuous oxygen the fhcrc study principal investigator pi must approve enrollment of all patients with pulmonary nodules
0,fallopian tube serous neoplasm diagnosis and patients who are pregnant or nursing
0,stage iv breast cancer diagnosis and patients may not be receiving any other investigational agents
0,pancreatic cancer diagnosis and congestive heart failure severe cardiac arrhythmias or coronary ischemic disease
0,stage ivb colon cancer diagnosis and prior treatment with irinotecan five fluoruracil or bevacizumab is allowed
1,esophageal adenocarcinoma diagnosis and patients eighteen years of age or older
0,carcinoma hepatocellular diagnosis and patients with six or more lesions are not eligible
1,lymphoma diagnosis and not pregnant or nursing
0,ovarian cancer diagnosis and any of the following within the six months prior to study drug administration
0,stage iii adult diffuse small cleaved cell lymphoma diagnosis and patient or donor with history of hepatitis or and or positive serology consistent with previous hepatitis or infection patients and or donor who received hepatitis vaccination are acceptable
0,stage iiib ovarian cancer diagnosis and patients with serious non healing wound ulcer or bone fracture this includes history of abdominal fistula gastrointestinal perforation or intra abdominal abscess within twenty-eight days patients with granulating_incisions healing by secondary intention with no evidence of fascial_dehiscence or infection are eligible but require weekly wound examinations
0,isolated plasmacytoma of bone diagnosis and uncontrolled diabetes on appropriate therapy
1,undifferentiated ovarian carcinoma diagnosis and platelets greater_than equal_than one hundred zero mcl
1,colorectal cancer diagnosis and cardiovascular
0,thyroid neoplasms diagnosis and contra indications for fdg pet ct
1,brain and central nervous system tumors diagnosis and no gross hemoptysis greater_than ½_teaspoon within the past two months
0,adenoma diagnosis and age below eighteen years
1,stage iv adult lymphoblastic lymphoma diagnosis and has internet and email access indicated by logon to site for consent and assessment
1,stage iii prostate cancer diagnosis and bilirubin within normal limits
1,peritoneal cavity cancer diagnosis and chemotherapy
0,multiple myeloma diagnosis and is female who is pregnant or intends to become pregnant during the study
1,non hodgkins lymphoma diagnosis and two ucb units selected according to current mskcc unit selection algorithm
0,recurrent grade one follicular lymphoma diagnosis and inability to achieve adequate venous access
0,breast cancer diagnosis and irradiation for benign breast conditions including breast inflammation after giving birth
0,adult primary hepatocellular carcinoma diagnosis and patients with known allergy to boron mannitol or bortezomib
1,transaminases less_than doc times upper limit of normal unless attributed to lymphoma
0,cancer diagnosis and any kind of contraindications to the use of opioid drugs
0,head and neck cancer diagnosis and liver disease such as cirrhosis severe hepatic impairment hepatitis or c
1,sarcoma diagnosis and absolute neutrophil count anc greater_than doc ten nine platelets greater_than ten0 ten nine hemoglobin hb greater_than nine dl
0,breast cancer diagnosis and severe systemic disease and or uncontrollable infection unable to be enrolled in this study
0,stage iii adult lymphoblastic lymphoma diagnosis and pregnant or breast feeding females lactating females must agree not to breast feed while taking lenalidomide
0,duct cell adenocarcinoma of the pancreas diagnosis and congestive heart failure chf of new york heart association nyha class greater_than equal_than three or
0,advanced solid tumors diagnosis and patients with active central nervous system or brain metastasis at the time of study entry
0,stage iv non small cell lung cancer diagnosis and history of allergic reactions attributed to compounds of similar chemical or biological composition to cixutumumab
0,recurrent adult hodgkin lymphoma diagnosis and donors
0,stage iii soft tissue sarcoma diagnosis and human immunodeficiency virus hiv positive subjects on combination antiretroviral therapy are ineligible
1,prostatic neoplasms diagnosis and life expectancy of greater than three months
1,carcinoma non small cell lung diagnosis and ecog performance status score of zero one or two
0,osteosarcoma diagnosis and hypersensitivity to pembrolizumab or any of its excipients
0,male breast cancer diagnosis and uncontrolled brain metastases note
0,adrenal cancer diagnosis and mitotane level greater_than five
0,mantle cell lymphoma refractory diagnosis and contraindication to any drug contained in the three chemotherapy regimens chop fc dha
1,recurrent refractory childhood hodgkin lymphoma diagnosis and total bilirubin equal_than less_than doc mg dl does not apply to patients with gilbert syndrome
0,stage iv pancreatic cancer diagnosis and strong inhibitors of cypthreeafour
1,adenosquamous cell lung cancer diagnosis and lesions that can be accurately measured in at least one dimension longest diameter to be recorded as greater_than twenty mm with conventional techniques or as greater_than ten mm with spiral ct scan
0,serrated adenomas diagnosis and patients with inflammatory bowel disease
0,refractory plasma cell myeloma diagnosis and verapamil
0,carcinoma hepatocellular diagnosis and history of allergic reaction to compound chemically related to cap
0,other malignancy within the past three years except nonmelanoma skin cancer
0,non small cell lung cancer diagnosis and medical or psychological condition that would not permit the patient to complete the study or sign informed consent
0,multiple myeloma diagnosis and age greater_than eighteen years
0,liver neoplasms diagnosis and known history of human immunodeficiency virus hiv infection
0,adenocarcinoma of the gastroesophageal junction diagnosis and patients who are pregnant
0,fallopian tube cancer diagnosis and patients who have had cns disease curatively treated and without recurrence for two years may be eligible
1,penile cancer diagnosis and filgrastim
0,gastric cancer diagnosis and unable to take oral medications that could affect oral intake of capecitabine and telatinib
0,neoplasm metastasis diagnosis and major medical illnesses or psychiatric impairment
0,stage iib ovarian cancer diagnosis and patients who in the opinion of the treating physician have medical condition or currently take medications which are felt to contraindicate safe or effective administration of the standard three drug anti emetic regimen used in this study
0,advanced cancer diagnosis and requirement for iv alimentation
0,contiguous stage ii adult diffuse large cell lymphoma diagnosis and donors who are hiv positive and or medical conditions that would result in increased risk for csf mobilization and harvest of pbmc
1,stage iii adult burkitt lymphoma diagnosis and no known glucose six phosphate dehydrogenase gsixpd deficiency
0,multiple myeloma diagnosis and presence of positive test results for hepatitis or hepatitis c
0,recurrent renal cell cancer diagnosis and patients with known hypersensitivity to everolimus everolimus or other rapamycins_sirolimus temsirolimus or to its excipients
0,breast cancer treatment for the currently diagnosed breast cancer including radiation therapy chemotherapy targeted therapy or endocrine therapy prior to study registration
0,ovarian mucinous adenocarcinoma diagnosis and patients with medical history or conditions not otherwise previously specified which in the opinion of the investigator should exclude participation in this study the investigator should feel free to consult the study chair or study co chairs for uncertainty in this regard
1,refractory nasopharyngeal carcinoma diagnosis and signed informed consent
1,astrocytoma grade iv diagnosis and creatinine less_than iuln or creatinine clearance greater_than sixty ml min doc three mtwo for patients with creatinine levels above institutional normal
0,unspecified adult solid tumor protocol specific diagnosis and brain metastasis or resection cavity volume less_than three cm or greater_than six cm
1,histologically or cytologically confirmed pancreatic adenocarcinoma that has metastatic disease measurable by ct mri or pet
1,ovarian cancer diagnosis and no pregnant or breastfeeding individuals
1,stage iv adult burkitt lymphoma diagnosis and congenital primary immunodeficiencies including but not limited to severe combined immunodeficiency syndrome wiskott_aldrick syndrome cdforty_ligand deficiency cell deficiencies
0,diffuse large cell lymphoma diagnosis and uncontrolled diabetes as defined by fasting serum glucose greater_than doc uln
0,stage iv adult soft tissue sarcoma diagnosis and requirement for hemodialysis or peritoneal dialysis
0,breast cancer diagnosis and hemoglobin teng dl
0,unspecified childhood solid tumor protocol specific diagnosis and patients who have received prior solid organ transplantation are not eligible
0,hepatocellular carcinoma diagnosis and patient has severe malfunction of vital organs and can not participate in this study justified by the doctor in this research team
0,hertwo positive breast cancer diagnosis and previous enrollment in an investigational drug study within the past four weeks
0,lung cancer diagnosis and supplementation of electrolytes is permitted
0,hepatoblastoma diagnosis and subjects with uncontrolled infection
0,recurrent childhood large cell lymphoma diagnosis and no psychiatric conditions which would prevent delivery of care psychology clearance is necessary
0,subjects with concurrently active second malignancy other than adequately treated non melanoma skin cancers in situ melanoma or in situ cervical cancer
0,ewing sarcoma family of tumors diagnosis and pregnant or breast feeding females are excluded because of the potential harmful effects of sorafenib and irinotecan on developing fetus or nursing child
0,lung cancer diagnosis and with the exception of physiologic steroid replacement
0,recurrent squamous cell carcinoma of the lip and oral cavity diagnosis and active autoimmune disease
0,recurrent colorectal carcinoma diagnosis and seasonal influenza vaccines for injection are generally_inactivated flu vaccines and are allowed however intranasal influenza vaccines flu_mist are live attenuated vaccines and are not allowed
0,transformed recurrent non hodgkin lymphoma diagnosis and history of myocardial infarction equal_than less_than one hundred and eighty days prior to registration or congestive heart failure requiring use of ongoing maintenance therapy for life threatening ventricular arrhythmias
0,stage iiib skin melanoma diagnosis and steroid therapy or steroid therapy with more than seven consecutive days of steroids within the prior four weeks
1,multiple myeloma diagnosis and ecog performance status zero two appendix e
1,recurrent pancreatic cancer diagnosis and platelets greater_than equal_than one hundred zero cells mm three
0,metastatic breast cancer diagnosis and subjects with regional lymph node as the only site of metastatic disease
0,kidney cancer diagnosis and scheduled major surgery within the treatment period
0,burkitt lymphoma diagnosis and concomitant medication
1,melanoma diagnosis and prior treatment with vemurafenib will be allowed must not have taken hypomethylating agent
0,astrocytoma diagnosis and personal history of hepatitis or other liver diseases
0,ovarian cancer diagnosis and uncontrolled hypertension
1,laryngeal neoplasms diagnosis and nutritional status appropriate
0,carcinoid tumors diagnosis and no waiting required following port cath placement
1,recurrent primitive neuroectodermal tumor diagnosis and note
0,advanced solid tumor diagnosis and preexisting uncontrolled hypertension defined as more than one hundred and forty ninety mmhg by using single agent therapy grade one nci ctcae doc myocardial ischemia arrhythmia cardiac function insufficiency
0,colorectal cancer diagnosis and sensory alteration or paresthesia interfering with function
0,lung cancer diagnosis and patient has signs or symptoms of acute infection requiring systemic therapy
1,recurrent prostate cancer diagnosis and performance status less_than two
0,non small cell lung carcinoma diagnosis and peripheral neuropathy greater_than equal_than grade two common toxicity criteria adverse event ctcae version doc
1,lung cancer diagnosis and angina pectoris
1,relapsed and refractory multiple myeloma diagnosis and hemoglobin greater_than doc dl
0,stage iiia primary peritoneal cancer diagnosis and active infection requiring antibiotics
0,multiple myeloma diagnosis and clinically significant pleural effusion in the previous twelve months or current ascitis
1,childhood diffuse large cell lymphoma diagnosis and viral load has decreased by greater_than equal_than doc logs or viral load less_than five thousand copies ml plasma on haart therapy
0,breast cancer diagnosis and patients may not have been exposed to prior anthracyclines
0,recurrent adult brain tumor diagnosis and patients who have serious medical or psychiatric illness that could in the investigator opinion potentially interfere with the completion of treatment according to this protocol or may not be able to comply with the safety monitoring requirements of the study
1,melanoma skin diagnosis and no concurrent barbiturates
1,metastatic gastrointestinal carcinoid tumor diagnosis and no left ventricular hypertrophy by ekg
1,pancreatic cancer diagnosis and more than seven days since prior and no concurrent digoxin or thiazide diuretic therapy
0,small intestinal lymphoma diagnosis and malignancy treated with curative intent and with no evidence of active disease present for more than three years prior to screening and felt to be at low risk for recurrence by treating physician
0,stage iv adult diffuse large cell lymphoma diagnosis and pregnant women are excluded from this study because the effects of at one hundred and one on the developing human fetus are unknown but could potentially include teratogenic or abortifacient effects because there is an unknown but potential risk for adverse events in nursing infants secondary to treatment of the mother with at one hundred and one breastfeeding should be discontinued if the mother is treated with at one hundred and one these potential risks may also apply to other agents used in this study
1,ovarian sarcoma diagnosis and negative pregnancy test
0,stage ivc verrucous carcinoma of the larynx diagnosis and although there are no known adverse effects of black_raspberries upon the fetus if patients become pregnant during period of lyophilized_black raspberries_lbr administration then lbr will be discontinued and patient will be removed from the study we should however emphasize given this is food based study that risks are likely extremely low even though participant should become pregnant as such we are not recommending active contraception for women but rather if participants become pregnant that they notify their study doctor and that they will likely be removed from study there are no expected or logical risks if men were to father child and as such no contraception will be recommended for men
1,cutaneous cell lymphoma diagnosis and eighteen and older
1,stage iii lymphoepithelioma of the oropharynx diagnosis and or interferon based therapy
0,lymphoma small lymphocytic diagnosis and dlco greater_than fifty of predicted value corrected for hemoglobin
1,sarcoma diagnosis and diagnosis of hematologic malignancy or nonmalignancy
1,lung cancer diagnosis and no significant history of uncontrolled cardiac disease including but not limited to any of the following
0,lymphoma diagnosis and patients known to be human immunodeficiency virus hiv positive
0,lip and oral cavity squamous cell carcinoma diagnosis and alanine aminotransferase alt or aspartate aminotransferase ast greater_than doc ulrr
0,duct cell adenocarcinoma of the pancreas diagnosis and lactating females
1,esophagogastric junction neoplasms diagnosis and scchn patients who are candidates for definitive chemoradiation are not eligible to participate
0,stage iv adult immunoblastic large cell lymphoma diagnosis and patients who have received maximally allowed doses given in two gy fractions or equivalent of previous radiation therapy to various organs as follows
1,unspecified adult solid tumor protocol specific diagnosis and greater than three months hematopoietic
1,cancer diagnosis and patients willing and able to comply with the study protocol for the duration of the study
0,her two positive breast cancer diagnosis and ventricular arrhythmias except for benign premature ventricular contractions
1,neuroblastoma diagnosis and age
0,malignant melanoma diagnosis and seasonal influenza vaccines for injection are generally_inactivated flu vaccines and are allowed however intranasal influenza vaccines are live attenuated vaccines and are not allowed
1,pancreatic cancer diagnosis and negative pregnancy test
0,bladder cancer diagnosis and the pi will serve as the final arbiter as to what constitutes major surgery
0,pancreatic neuroendocrine tumor diagnosis and congestive heart failure unstable angina sustained ventricular tachycardia ventricular fibrillation clinically significant bradycardia advanced heart block or history of acute myocardial infarction within the six months preceding enrollment
1,childhood nodular lymphocyte predominant hodgkin lymphoma diagnosis and doc mg dl one to five months
1,gastroesophageal cancer diagnosis and acceptable renal function
0,fallopian tube neoplasms diagnosis and patients requiring any concomitant treatment with medication that may inhibit cytochrome pfour hundred and fifty threeafour cypthreeafour will not be permitted to begin this study
0,ovarian clear cell cystadenocarcinoma diagnosis and complete left bundle_branch block
0,unspecified adult solid tumor protocol specific diagnosis and patients who have been on megestrol acetate for greater_than one month and are still on it and otherwise meet the eligibility criteria are permitted to enroll on this protocol and remain on megestrol acetate
1,sarcoma diagnosis and not specified
0,diffuse large cell lymphoma dlbcl diagnosis and prior organ transplantation including prior allogeneic sct
1,small intestine lymphoma diagnosis and female subjects
1,stage ib non small cell lung cancer diagnosis and initiation of protocol treatment must begin within ten working days of patient randomization
0,hiv associated hodgkin lymphoma diagnosis and hiv related wasting syndrome
0,recurrent childhood anaplastic large cell lymphoma diagnosis and patients who in the opinion of the investigator may not be able to comply with the safety monitoring requirements of the study are not eligible
0,stage iii adult immunoblastic large cell lymphoma diagnosis and concomitant anti graft versus host disease gvd treatment includes in vivo cell depletion
0,recurrent cervical carcinoma diagnosis and patients with significant peripheral vascular disease
0,stage iv adult diffuse large cell lymphoma diagnosis and women who are pregnant or breast feeding
0,stage iiia intraocular melanoma diagnosis and history of severe allergic reaction to sunitinib or valproic acid inability to receive sunitinib or valproic acid
