Classification,Summary
1,recurrent grade three follicular lymphoma diagnosis and received high dose chemotherapy with autologous stem cell transplantation asct from forty-two to one hundred and twenty-eight days before enrollment with stable disease partial response or complete response following asct
1,lymphoma diagnosis and age
0,lymphoma mantle cell diagnosis and who performance status greater_than two
0,breast cancer diagnosis and has direct relationship to or involvement in this or other studies under the direction of the investigator or center
0,melanoma diagnosis and current treatment on another clinical trial
0,colorectal carcinoma diagnosis and prior treatment with an mtor inhibitor
0,unspecified adult solid tumor protocol specific diagnosis and serious or non healing wound ulcer or bone fracture
0,mantle cell lymphoma diagnosis and prolonged corrected qt interval qtc on electrocardiogram ekg
1,breast cancer diagnosis and not specified
0,lung cancer diagnosis and severe allergy or hypersensitivity to iv radiographic contrast
0,stage iib prostate cancer diagnosis and patients with inflammatory bowel disease or other autoimmune conditions which might affect the radiated colon or rectum
1,anaplastic large cell lymphoma alk positive diagnosis and barrier methods of contraception
0,acinar cell adenocarcinoma of the pancreas diagnosis and phase ii
0,symptomatic or uncontrolled brain metastases requiring concurrent treatment inclusive of but not limited to surgery radiation and or corticosteroids
1,recurrent adult hodgkin lymphoma diagnosis and not pregnant or nursing
0,stage iv adult diffuse large cell lymphoma diagnosis and patients who are homozygous at the mismatched major histocompatibility_complex mhc class locus
0,concurrent use of other anti cancer agents or treatments concurrent radiation to the pelvis
0,recurrent adult grade iii lymphomatoid granulomatosis diagnosis and pregnant or breast feeding females lactating females must agree not to breast feed while taking lenalidomide
0,stage iii adult cell leukemia lymphoma diagnosis and patient scheduled for cord blood transplantation
0,stomach neoplasms diagnosis and myasthenia_gravis or eaton lambert syndrome
0,untreated childhood rhabdomyosarcoma diagnosis and patients who have previously received tori another mtor inhibitor or any other investigational agent
0,stage iii oral cavity squamous cell carcinoma diagnosis and participant is currently taking an enzyme inducer of cyptwoceight carbamazepine carbatrol_epitol equetro_tegretol cortisol hydrocortisone dexamethasone decadron phenobarbital luminal sodium phenytoin dilantin_phenytek novaplus phenytoin sodium primidone mysoline rifampin rifadin rimactane rifapentine priftin secobarbital seconal
0,non hodgkin lymphoma diagnosis and active acute or chronic infection or anti infective therapy within one week prior to randomization
0,stage iiia ovarian cancer diagnosis and major surgical procedure anticipated during the course of the study this includes but is not limited to abdominal surgery laparotomy or laparoscopy prior to disease progression such as colostomy or enterostomy_reversal interval or secondary cytoreductive surgery or second look surgery please consult with the study chair prior to patient entry for any questions related to the classification of surgical procedures
1,lung cancer diagnosis and histological or unequivocal cytological proof of nsclc
1,pancreatic cancer diagnosis and disease characteristics
0,childhood immunoblastic large cell lymphoma diagnosis and for blood stem cells
1,stage iva nasal cavity and paranasal sinus squamous cell carcinoma diagnosis and no known brain metastases
0,recurrent fallopian tube carcinoma diagnosis and presence of unstable atrial fibrillation ventricular response greater_than one hundred beats per minute
0,stage ii oral cavity squamous cell carcinoma diagnosis and breastfeeding should be discontinued if the mother is treated with actoplus met xr
1,recovered from all toxicities associated with prior treatment to acceptable baseline status for laboratory toxicity see below limits for inclusion or national cancer institute common terminology criteria for adverse events nci ctcae version doc three grade of zero or one except for toxicities not considered safety risk alopecia or vitiligo
0,unable to swallow capsules malabsorption syndrome disease significantly affecting gastrointestinal function resection of the stomach or small bowel symptomatic inflammatory bowel disease or ulcerative colitis or partial or complete bowel obstruction
0,relapsed solid tumors diagnosis and patient with illness psychiatric disorder or social issue that could compromise patient safety or compliance with the protocol treatment or procedures or interfere with the consent study participation follow up or interpretation of study results
1,large cell lung cancer diagnosis and no other uncontrolled concurrent illness
0,history of previous malignancy within five years with the exception of non metastatic non melanoma skin cancer or cervical carcinoma in situ
0,prostate cancer diagnosis and photodynamic therapy
0,cancer diagnosis and inflammatory bowel disease
0,breast cancer stage ii diagnosis and active autoimmune disease requiring systemic treatment within the past two years ie with use of disease modifying agents corticosteroids or immunosuppressive drugs or documented history of clinically severe autoimmune disease or syndrome that requires systemic steroids or immunosuppressive agents note
0,cancer survivor diagnosis and paralysis dementia blindness untreated stage three hypertension or myocardial infarction congestive heart failure or conditions that required oxygen or hospitalization within six mo
1,stage iv adult diffuse large cell lymphoma diagnosis and if day twenty-eight or forty-two falls on weekend or holiday the limit may be extended to the next working day
0,metastatic melanoma diagnosis and men who do not use an effective method of contraception
1,adenocarcinoma of the stomach diagnosis and no serious medical or psychiatric illnesses which would prevent informed consent or otherwise limit survival to less than two years no history of refractory congestive heart failure or cardiomyopathy
0,recurrent small cell lung carcinoma diagnosis and uncontrolled brain metastases or leptomeningeal involvement patients with brain metastases are permitted if they have received appropriate therapy and demonstrated control of the brain metastases or leptomeningeal disease following therapy patients with known brain metastases will require magnetic resonance imaging mri brain to demonstrate disease control prior to enrollment lack of symptom progression for two weeks off therapeutic doses of steroids excluding chronic steroids used for control of chronic obstructive pulmonary disease copd
0,peritoneal carcinoma diagnosis and has active autoimmune disease that has required systemic treatment in the past two years with use of disease modifying agents corticosteroids or immunosuppressive drugs
1,gastric cancer diagnosis and see appendix for tnm staging guide
1,intermediat negative or high grade non hodgkin lymphoma nhl meeting one of the following criteria
0,ovarian clear cell adenocarcinoma diagnosis and note
0,ewing sarcoma diagnosis and patients who in the opinion of the investigator may not be able to comply with the safety monitoring requirements of the study
0,recurrent fallopian tube carcinoma diagnosis and no poorly differentiated subtypes including papillary serous clear cell or other international federation of gynecology and obstetrics_figo grade three lesions
0,malignant melanoma diagnosis and systemic steroid therapy
0,stage ivb colon cancer diagnosis and active ulcerative colitis crohn disease or celiac disease that could interfere with the absorption of the drug
0,stage iv cutaneous cell non hodgkin lymphoma diagnosis and patients with poorly controlled hypertension on multiple antihypertensives
0,adult mixed glioma diagnosis and subjects with radiographic signs of excessive intracranial mass effect with associated rapid neurologic deterioration and or spinal cord block
0,recurrent grade one follicular lymphoma diagnosis and other serious medical conditions considered to represent contraindications to autologous stem cell transplant asct active coronary artery disease pulmonary dysfunction forced expiratory volume in one second fevone less_than seventy expected vital capacity less_than seventy expected diffusing capacity of the lung for carbon monoxide dlco less_than fifty patient on supplemental oxygen aids etc
0,estrogen receptor positive tumor diagnosis and females will be considered to be of childbearing potential unless they are postmenopausal at least twelve months consecutive amenorrheic or have had bilateral oophorectomy or if they have had hysterectomy but with ovaries intact then females must be age fifty-five or older and with postmenopausal fsh levels
0,gastroesophageal junction cancer diagnosis and criteria of unresectability
0,lymphoma non hodgkin diagnosis and systemic infection requiring iv antibiotic therapy or other serious infection within fourteen days before the first dose of study drug
0,pancreatic cancer stage iva diagnosis and prior malignancies in last five years other than
0,endometrial clear cell adenocarcinoma diagnosis and men or women of childbearing potential who are unwilling to employ adequate contraception
0,metastatic breast cancer diagnosis and assessed by the investigator to be unable or unwilling to comply with the requirements of the protocol
1,rectal cancer diagnosis and disease characteristics
0,recurrent primary peritoneal carcinoma diagnosis and history of inflammatory bowel disease requiring ongoing therapy
0,systemic therapy including radiation therapy surgery chemotherapy or investigational therapy within one month prior to day one week one two months for nitrosoureas or mmc unless given as standard treatment for bladder cancer and provided that patient is free of all treatment related toxicities as of day one week one
0,cutaneous cell non hodgkin lymphoma diagnosis and females who are pregnant
0,non small cell lung cancer diagnosis and clinically significant bleeding such as gross hematuria gi bleeding and hemoptysis within twelve months of screening
0,lung cancer patients
0,a history of prior malignancy except for adequately treated carcinoma in situ of the uterine cervix basal cell or squamous cell skin cancer or other cancer for which the patient has been disease free for two years
0,stage iii squamous cell carcinoma of the hypopharynx diagnosis and contraindication to full course chemoradiotherapy
0,fallopian tube cancer diagnosis and patients who have had bowel irradiation within six weeks
1,recurrent squamous cell carcinoma of the lip and oral cavity diagnosis and previously untreated and not candidate for il two based therapy
0,head and neck cancer diagnosis and patient who has had surgery within two cm of the treatment area within the past two weeks
0,colon cancer diagnosis and musculoskeletal disorders severely restricting the patients mobility gonarthrosis coxarthrosis
0,multiple myeloma diagnosis and pleural or pericardial effusion of any grade at the time of screening for study
1,patients with relapsed or refractory solid tumors with no viable treatment options
0,stage iv soft tissue sarcoma diagnosis and prior systemic therapy with an anthracycline for any indication
0,breast cancer diagnosis and any exclusion criterion in the local centre treatment policy
0,recurrent grade one follicular lymphoma diagnosis and human immunodeficiency virus hiv positive patients
0,stage iva uterine corpus cancer diagnosis and patients with ctcae v
0,patients with symptomatic cns metastases from breast cancer
1,gastrointestinal stromal tumor gist diagnosis and patient must have undergone complete gross resection of primary gist within twelve weeks prior to first dose of imatinib study drug
0,contiguous stage ii small lymphocytic lymphoma diagnosis and donor
0,stage ii childhood small noncleaved cell lymphoma diagnosis and patients with uncontrolled seizures as defined by having any seizure activity within the three months prior to screening
0,squamous cell lung cancer diagnosis and performance status
1,hepatocellular cancer hcc diagnosis and doc institutional uln
1,malignant pharyngo laryngeal tumors diagnosis and eighteen years
0,ovarian neoplasms diagnosis and patients with history of severe hypersensitivity to taxotere topotecan or other drugs formulated with polysorbate eighty
0,gastric adenocarcinoma diagnosis and long term toxicity related to radiotherapy won be fully recovered as judged by investigator
1,ductal adenocarcinoma of the prostate is included
0,multiple myeloma diagnosis and serum creatinine greater_than doc mg dl two hundred and twenty-one umol l
0,stage ii bladder urothelial carcinoma diagnosis and aspartate aminotransferase ast equal_than less_than three times uln
0,stage iia fallopian tube cancer diagnosis and patients with ctcae grade two or greater peripheral vascular disease at least brief less_than two4 hours episodes of ischemia managed non surgically and without permanent deficit
0,stage iii marginal zone lymphoma diagnosis and pregnant females
1,endometrial adenosquamous carcinoma diagnosis and paraaortic lymph node sampling allowed
1,b lymphoblastic lymphoma diagnosis and eastern cooperative oncology group ecog performance status zero to two
1,islet cell tumor diagnosis and no medically uncontrolled seizures
0,prostate cancer diagnosis and progressive disease as ascertained by the investigator using standard of care evaluations
1,recurrent breast carcinoma diagnosis and patients may have received an unlimited number of platinum based therapies in the recurrent setting
0,locally advanced malignant neoplasm diagnosis and presence of hepatitis surface antigen hbsag and or of hepatitis virus
1,stage ivc thyroid gland medullary carcinoma diagnosis and breastfeeding should be discontinued if the mother is treated with gwseven hundred and eighty-six thousand and thirty-four pazopanib
0,histiocytoma undifferentiated pleomorphic sarcoma diagnosis and pregnant women and women who are breast feeding
0,breast cancer diagnosis and minor surgical procedures excluding fine needle aspirations or core biopsies within five days prior to day zero
0,regional digestive system neuroendocrine tumor gone diagnosis and prior use of bevacizumab is not allowed in any cohort
0,stage iv colon cancer diagnosis and known dihydropyrimidine_dehydrogenase dpd deficiency
1,stage iva verrucous carcinoma of the larynx diagnosis and aspartate aminotransferase ast or alanine aminotransferase alt less_than twox the upper limit of normal
0,stage iv gastric cancer with metastasis diagnosis and neutrophils greater_than one five one09 and platelets one00 one09 l
0,stage iiib breast cancer diagnosis and patients with diabetes mellitus requiring insulin treatment and or with clinical signs or with fasting plasma glucose fpg greater_than equal_than one hundred and forty mg dl doc mmol or history of documented steroid induced diabetes mellitus are not eligible for participation
0,neuroblastoma diagnosis and history of autoimmune disorder or immune deficiency disorder
0,anticancer chemotherapy or immunotherapy during the study or within four weeks of study entry
1,stage iva mucosal melanoma of the head and neck diagnosis and step one registration
1,recurrent malignant testicular germ cell tumor diagnosis and adequate hematopoietic cardiac renal and hepatic function
0,mantle cell lymphoma diagnosis and patients who are pregnant or breastfeeding
0,thyroid gland medullary carcinoma diagnosis and patients should not have any uncontrolled illness including ongoing or active infection
1,noncontiguous stage ii adult burkitt lymphoma diagnosis and voluntary written informed consent form before performance of any study related procedure not part of normal medical care with the understanding that consent may be withdrawn by the subject at any time without prejudice to future medical care
0,esophageal cancer diagnosis and history of interstitial pneumonitis or pulmonary fibrosis or evidence of interstitial pneumonitis or pulmonary fibrosis on screening chest computed tomograph ct scan
0,carcinoma non small cell lung diagnosis and radi negative immun negative or chemotherapy within the last two weeks prior to receiving the first dose of investigational treatment
0,adult solid neoplasm diagnosis and use combination of the following
0,stage ivb cervical cancer diagnosis and uncontrolled diabetes mellitus as defined by hemoglobin aonec hbaonec greater_than eight despite adequate therapy unstable coronary artery disease or myocardial infarction during preceding six months or hypertension uncontrolled by medication
1,stage iii adult immunoblastic large cell lymphoma diagnosis and when evaluating patients for unrelated donor transplant higher degree of matching is preferred due to minimize the risk of gvhd the b drbone and dq loci comprising one0 possible alleles will be typed routinely for all unrelated transplants given the higher risk of trm in mismatched transplants rit is often the best way to mitigate the risk evolving data from the national marrow donor program now makes it possible to estimate the risks of donor recipient hla mismatch at the allele or antigen level the higher risk from hla mismatching must be carefully assessed with respect to the clinical urgency and the patient risk by the transplant physician antigen level mismatches at dq are inconsequential to transplant outcomes and are ignored with respect to donor selection for the purposes of this protocol with matching requirements confined to the eight loci involving hla b and drbone for the purpose of this protocol single antigen mismatch at hla b or with or without additional single allele level mismatch may participate in this protocol for voluntary unrelated donors blood or marrow patients must be at least antigen level matched at drbone
1,recurrent adult diffuse large cell lymphoma diagnosis and total bilirubin within normal institutional limits
0,giant cell tumor of bone diagnosis and diagnosed or suspected congenital long qt syndrome
0,presence of small cell lung cancer alone or with nsclc
0,concurrent treatment with any other anticancer therapy except lh_rh agonist therapy initiated greater_than two months prior to study entry
1,colon cancer diagnosis and
1,extragonadal germ cell tumor diagnosis and at least six months since prior hematopoietic stem cell transplantation
1,myelodysplastic myeloproliferative neoplasm unclassifiable diagnosis and relapsed or refractory acute lymphoblastic leukemia
0,stage iiia ovarian cancer diagnosis and new york heart association nyha grade ii or greater congestive heart failure
0,recurrent childhood large cell lymphoma diagnosis and twenty pediatric
0,metastatic breast cancer diagnosis and patients who are pregnant or breast feeding
0,recurrent pancreatic carcinoma diagnosis and participants receiving any medications or substances that are strong inhibitors or inducers of cytochrome pfour hundred and fifty family three subfamily polypeptide four cypthreeafour are ineligible dihydropyridine calcium channel blockers are permitted for management of hypertension
0,ovarian neoplasms diagnosis and any significant medical condition laboratory abnormality or psychiatric illness that would prevent the subject from participating in the study
0,bladder cancer diagnosis and men must have been surgically sterilised or use double if required barrier method of contraception
1,stage adult hodgkin lymphoma diagnosis and has not been naturally postmenopausal for at least twelve consecutive months has had menses at any time in the preceding twelve consecutive months
0,receipt of more than three doses of human papillomavirus hpv vaccine
0,ovarian cancer diagnosis and twenty-five mg kg prednisone per day maximum doc mg day and bronchodilators inhaled steroids are permitted other steroid regimens and or immunosuppressives are excluded
1,stage adult diffuse small cleaved cell lymphoma diagnosis and must have already been determined to be eligible for hct at city of hope_coh
0,stage iv childhood small noncleaved cell lymphoma diagnosis and uncontrolled intercurrent illness including but not limited to ongoing or active infection requiring parenteral antibiotics on day one
0,pheochromocytoma
0,hepatosplenic cell lymphoma diagnosis and patients who have an uncontrolled intercurrent illness including but not limited to any of the following are not eligible
0,sarcoma diagnosis and pregnant and or lactating women will be excluded due to the unknown potentially harmful effects of immune response to ct antigens and stem cell proteins that may be expressed in placenta fetus and neonates
1,unspecified adult solid tumor protocol specific diagnosis and standard curative or palliative measures do not exist or are no longer effective or patient refused such measures
0,prostate cancer adenocarcinoma in situ diagnosis and previous or concurrent use of cyclophosphamide
0,breast cancer diagnosis and cytotoxic chemotherapy within three weeks of first trilaciclib gonettwenty-eight dose
1,multiple myeloma diagnosis and haemoglobin greater_than eight dl
1,estrogen receptor negative breast cancer diagnosis and must have undergone prior therapy with an anthracycline and taxane either in the adjuvant or metastatic setting
0,concurrent use of other anti cancer agents or treatments
0,uterine leiomyomata diagnosis and mri or mri contrast agent contraindicated
0,recurrent grade two follicular lymphoma diagnosis and any patient who is unable to provide informed consent or comply with the requirements of the protocol
0,stage iv marginal zone lymphoma diagnosis and patient requires supplemental oxygen
1,stage cutaneous cell non hodgkin lymphoma diagnosis and serum creatinine less_than doc mg dl or creatinine clearance greater than sixty ml per minute by the following formula all tests must be performed within twenty-eight days prior to registration
0,multiple myeloma diagnosis and patients with evidence of mucosal or internal bleeding and or platelet transfusion refractory unable to maintain platelet count greater_than fifty zero cells dl
1,patients must have had two or fewer cycles doses of induction chemotherapy and must have had tumor response to the induction therapy
0,advanced cancer diagnosis and intolerance to any antineoplastic agents belonging to the taxoid family
0,stage iiia non small cell lung cancer diagnosis and severe active co morbidity defined as follows
0,carcinoma squamous cell of head and neck diagnosis and significant or recent acute gastrointestinal disorders with diarrhea as major symptom crohn disease malabsorption or ctcae grade greater_than one diarrhea of any etiology at randomisation
0,stage ii breast cancer diagnosis and any history of stroke or transient ischemic attack at any time
0,stage iv childhood anaplastic large cell lymphoma diagnosis and positive serology for toxoplasma_gondii on treatment or with evidence of active infection
0,recurrent adult grade iii lymphomatoid granulomatosis diagnosis and estimated risk of graft vs
1,multiple myeloma and plasma cell neoplasm diagnosis and no autoimmune disease or atopic allergy
1,multiple myeloma diagnosis and renal insufficiency s
0,stage ii hypopharyngeal squamous cell carcinoma diagnosis and documented evidence of distant metastases or brain metastases
0,lymphoblastic lymphoma
0,concurrent malignancy other than non melanoma skin carcinoma
1,recurrent squamous cell carcinoma of the oropharynx diagnosis and no prior surgical procedures affecting absorption
1,recurrent grade one follicular lymphoma diagnosis and donor
0,psychosocial effects of cancer and its treatment diagnosis and john wort phenytoin phenobarbital diazepam tricyclic_antidepressants
0,absence of both cell and cell phenotype markers in case submitted as lymphoblastic lymphoma
0,multiple myeloma diagnosis and related will undergo apheresis
1,adult lymphocyte predominant hodgkin lymphoma diagnosis and non pregnant and non nursing due to the teratogenic potential of these agents pregnant or nursing patients may not be enrolled women and men of reproductive potential should agree to use an effective means of birth control
0,stage iii grade one follicular lymphoma diagnosis and calculated creatinine clearance less_than forty cc min by the modified cockcroft gault formula for adults or the schwartz formula for pediatrics
0,subjects with squamous cell lung carcinoma
0,pregnancy woman of childbearing potential
0,breast cancer diagnosis and other medical or psychological conditions that would make participation unsafe or inhibit our ability to test our primary hypothesis parkinson disease severe dementia
0,stage childhood lymphoblastic lymphoma diagnosis and pregnancy
1,soft tissue sarcoma diagnosis and three or more lung lesions in total
0,malignant rhabdoid tumor diagnosis and known history of uncontrolled sleep_apnea syndrome or other conditions that could result in excessive_daytime sleepiness such as severe chronic obstructive pulmonary disease or requirement for supplemental oxygen
0,glioma diagnosis and inadequately controlled hypertension systolic blood pressure sbp greater_than one hundred and sixty mm hg and or diastolic pressure dbp greater_than ninety mm hg despite antihypertensive therapy
0,recurrent fallopian tube carcinoma diagnosis and decompensated liver disease
0,estrogen receptor positive breast cancer diagnosis and manifested pulmonary toxicity during the initial transplant period and have diffusion capacity corrected equal_than less_than sixty
