Classification,Summary
0,stage marginal zone lymphoma diagnosis and hiv positive patients on combination antiretroviral therapy are ineligible because of the potential for pharmacokinetic interactions with at one hundred and one or other agents used in this study in addition these patients are at increased risk of lethal infections when treated with marrow suppressive therapy appropriate studies will be undertaken in patients receiving combination antiretroviral therapy when indicated
1,lung cancer diagnosis and karnofsky performance status sixty one hundred
0,breast cancer with hepatic metastase diagnosis and nyha greater than or equal to two
0,advanced cancers diagnosis and uncontrolled arrhythmia as per clinical record at enrollment
0,evidence for the existence or history of other malignant neoplasms except adequately treated basal cell carcinoma and carcinoma in situ of the cervix
0,stage iiia non small cell lung cancer diagnosis and history of documented congestive heart failure new york heart association functional classification iii iv documented cardiomyopathy
1,osteosarcoma diagnosis and total bilirubin less_than doc uln
0,neoplasms diagnosis and psychological familial or sociological condition potentially hampering compliance with the study protocol and follow up schedule
0,noncontiguous stage ii mantle cell lymphoma diagnosis and patients with medical history of noncompliance with haart or medical therapy
1,pathologically confirmed invasive ductal carcinoma or invasive lobular carcinoma of the breast ttwo tfour tfoura nzero two mzero with positive estrogen and or progesterone receptors
0,stage ii childhood anaplastic large cell lymphoma diagnosis and patients with rapidly progressive intermediate or high grade nhl
0,previous malignant disease being disease free for less than five years except cis of the cervix and non melanomatous skin cancer
1,stage iv follicular thyroid cancer diagnosis and bilirubin equal_than less_than doc times upper limit of normal uln
0,adult anaplastic ependymoma diagnosis and renal impairment glomerular filtration rate gfr less_than sixty ml min doc threem two or history of existing nephrogenic systemic fibrosis nsf
0,stage iii cervical cancer diagnosis and hiv positive patients on combination antiretroviral therapy are ineligible because of the potential for pharmacokinetic interactions with triapine in addition these patients are at increased risk of lethal infections when treated with marrow suppressive therapy appropriate studies will be undertaken in patients receiving combination antiretroviral therapy when indicated hiv testing is not mandatory patients that are known to be hiv positive are ineligible if they are receiving combination antiretroviral therapy
0,recurrent adult diffuse large cell lymphoma diagnosis and fertile men or women unwilling to use contraceptive techniques during and for twelve months following treatment
0,recurrent grade one follicular lymphoma diagnosis and corticosteroid therapy also is not permitted while subjects are receiving protocol therapy during the treatment phase of the study
0,if the other primary malignancy is not currently clinically significant nor requiring active intervention or if other primary malignancy is basal cell skin cancer squamous skin cancer or cervical carcinoma in situ
0,hepatocellular carcinoma diagnosis and active clinically serious infections greater_than grade two nci ctc version doc including spontaneous bacterial peritonitis
0,prostate cancer diagnosis and hypersensitivity to gnrh gnrh agonists
1,esophageal cancer diagnosis and ecog zero two life expectancy
0,ovarian epithelial cancer recurrent diagnosis and prior doxorubicin exposure that would result in total lifetime exposure of five hundred and fiftymg mtwo or more after four cycles of treatment
0,metastatic gastric cancer diagnosis and age greater than or equal to sixty years old
1,breast cancer diagnosis and written informed consent are acquired
1,recurrent nasopharyngeal cancer diagnosis and at least six weeks since other prior substantial radiotherapy to the bone marrow
0,breast carcinoma diagnosis and previous reconstructive breast surgery
0,stage iiia gallbladder cancer diagnosis and arm cohort one
0,prior history of breast cancer are ineligible except
0,adult primary hepatocellular carcinoma diagnosis and hypertension
0,pancreatic cancer diagnosis and etc
1,recurrent adult diffuse small cleaved cell lymphoma diagnosis and mantle cell nhl may be treated in first cr
1,must have had tumor progression following blockade of both testicular and adrenal androgens
1,transitional cell cancer of the renal pelvis and ureter diagnosis and fertile patients must use effective contraception
0,adult fibrosarcoma diagnosis and female patients who are pregnant are ineligible
0,cervical cancer recurrent or persistent diagnosis and allergy history to compounds of chemical or biological similar composition to the monoclonal antibody being evaluated or to chemotherapeutic agents
0,breast neoplasms diagnosis and patients who are pregnant
0,solitary bone or extramedullary plasmacytoma
0,malignant tumor of the breast diagnosis and patient is currently part of or has participated in any clinical trial of an investigational agent within one month prior to enrollment in this study
1,mantle cell lymphoma diagnosis and failed flu cyclophosphamide cy rituximab fcr combination chemotherapy at any time point or
0,refractory cell lymphoma diagnosis and hiv positive individuals on combination antiretroviral therapy are ineligible
0,renal cancer diagnosis and additionally in patients who have received standard or experimental treatments for their rcc at least approximately five half lives should have elapsed from the last dose at the time of study entry
0,oropharynx cancer diagnosis and has known history of human immunodeficiency virus hiv hiv one two antibodies
0,refractory multiple myeloma diagnosis and active connective tissue disease
0,more than one infantile_hemangioma with largest diameter greater_than onecm
0,stage iv childhood burkitt lymphoma diagnosis and donor
0,advanced solid tumors amenable to anthracycline therapy diagnosis and growth factors or immunomodulatory agents within seven days prior to the administration of study treatment
0,recurrent mucoepidermoid carcinoma of the oral cavity diagnosis and patients with an active bleeding diathesis or on therapeutic anticoagulation except low dose coumadin
0,stage iv soft tissue sarcoma diagnosis and unwillingness to use an effective contraceptive method for the duration of their study participation and for at least one month after treatment is completed if sexually active with reproductive potential
1,metastatic breast cancer diagnosis and patients may have had prior chest wall irradiation or palliative radiation to bony sites for control of pain or fracture
1,recurrent adult diffuse large cell lymphoma diagnosis and ability to understand and the willingness to sign written informed consent document
0,adenocarcinoma of colon diagnosis and uncontrolled active infection
0,pancreatic alpha cell adenoma diagnosis and child pugh or classification
0,aids related diffuse large cell lymphoma diagnosis and donor
0,aggressive non hodgkin lymphoma diagnosis and uncontrolled viral or bacterial infection at the time of study enrollment
0,urethral cancer associated with invasive bladder cancer diagnosis and active or unstable cardiovascular disease or cardiac disease requiring drug or device intervention history of coronary artery disease or congestive heart failure
0,sarcoma diagnosis and patients should be switched to alternative therapies minimum of two weeks before starting study drug
1,refractory anaplastic large cell lymphoma diagnosis and patients can be enrolled up through day one of cycle three of therapy this includes the following disease types
0,colon mucinous adenocarcinoma diagnosis and patients with diabetes or in risk for hyperglycemia should not be excluded from trials with mk two thousand
1,rhabdomyosarcoma diagnosis and relapsed or refractory disease which has failed standard treatment approaches
0,ovarian endometrioid adenocarcinoma diagnosis and major surgical procedure open biopsy or significant traumatic injury equal_than less_than four weeks prior to registration
0,adenocarcinoma of the prostate diagnosis and absolute neutrophil count less_than one thousand
1,recurrent renal cell carcinoma diagnosis and patients with grade one prolonged qtc forty-five negative four hundred and eighty msec at the time of study enrollment should have correctable causes of prolonged qtc addressed if possible electrolytes medications
0,not being filipino american or up to date with colorectal cancer screening at baseline
0,peritoneal cancer diagnosis and platinum refractory disease is defined as relapse less than two months after the last dose of platinum based chemotherapy
1,diffuse large cell lymphoma transformed from follicular lymphoma diagnosis and normal cardiac ejection fraction and no evidence of pericardial effusion as determined by an echocardiogram
0,stage mantle cell lymphoma diagnosis and diffusion capacity of carbon monoxide dlco less_than forty total lung capacity tlc less_than forty forced expiratory volume in one second fevone less_than forty and or receiving supplementary continuous oxygen
0,concurrent hormonal therapy except steroids for adrenal failure hormones for non cancer related conditions insulin for diabetes or intermittent dexamethasone as an antiemetic
0,angioimmunoblastic cell lymphoma diagnosis and donor
0,melanoma diagnosis and pregnant or breast feeding females
1,pancreatic cancer diagnosis and eighteen years of age
0,stage iv childhood lymphoblastic lymphoma diagnosis and uncontrolled seizure disorder
1,liver cancer diagnosis and localized surgically unresectable disease
0,hepatocellular cancer diagnosis and active or clinically significant cardiac disease
0,gastroesophageal junction adenocarcinoma diagnosis and human immunodeficiency virus hiv
0,adult papillary meningioma diagnosis and patients with malabsorption syndrome or other condition that would interfere with intestinal absorption patients must be able to swallow tablets
1,bladder cancer diagnosis and see disease characteristics
1,ovarian neoplasms diagnosis and must have life expectancy of greater than three three months
0,pancreatic cancer diagnosis and use of any investigational product within four weeks of study enrollment
0,prostate cancer diagnosis and complete resolution of an intra abdominal abscess must be confirmed prior to initiating treatment with cabozantinib even if the abscess occurred more that six months ago
1,ebv related non hodgkin lymphoma diagnosis and n negative or lymphoproliferative disease in first relapse and or refractory to at least one salvage chemotherapy or with primary refractory disease after at least two lines of therapy or in second or subsequent relapse
1,lymphoma non hodgkin diagnosis and patients must have previously responded with duration of response of at least three months to iodine onethreeone anti bone antibody therapy
0,subjects with serious infection or life threatening illness unrelated to tumor that is greater_than grade two nci ctcae doc or active serious infections requiring parenteral antibiotic therapy
1,recurrent ovarian carcinoma diagnosis and bilirubin equal_than less_than doc uln
1,stage iv renal cell cancer diagnosis and fertile patients must use effective contraception during and for two months after study treatment
0,carcinoma squamous cell diagnosis and pregnancy or lactation
0,stage ii multiple myeloma diagnosis and participation in an investigational therapeutic study within three weeks or within five drug half lives tone two prior to first dose whichever time is greater
1,endometrial adenocarcinoma diagnosis and magnesium greater_than equal_than doc mmol l
0,ovarian carcinoma diagnosis and individuals who have had colonoscopy sigmoidoscopy or barium_enema in the past three years
0,cancer of the pharynx diagnosis and history of allergic reactions attributed to compounds of similar chemical or biologic composition to cisplatin five fluorouracil or hydroxyurea
0,stage iv mantle cell lymphoma diagnosis and female patients who are pregnant or breastfeeding
1,cancer related fatigue diagnosis and ability to understand and follow the study protocol
0,stage iv adult diffuse mixed cell lymphoma diagnosis and fertile men and women unwilling to use contraceptives during and for twelve months post transplant
1,chondrosarcoma
0,carcinoma in situ of the cervix
0,refractory diffuse large cell lymphoma diagnosis and received anticoagulation therapy with coumadin or equivalent vitamin antagonists within the last twenty-eight days
1,recurrent basal cell carcinoma of the lip diagnosis and her two not amplified by fluorescence in situ hybridization
0,advanced adult hepatocellular carcinoma diagnosis and core biopsy equal_than less_than seven days prior to registration
0,neoplasm diagnosis and any mental or physical condition in the opinion of the principal investigator pi or pi designee which could interfere with the ability of the subject to understand or adhere to the requirements of the study
0,prostate adenocarcinoma
0,stage iii mantle cell lymphoma diagnosis and uncontrolled hypertension as indicated by sbp greater_than one hundred and seventy mmhg or diastolic blood pressure dbp greater_than one hundred and five mmhg on two consecutive measurements at screening visit
0,small intestine lymphoma diagnosis and donors who are positive for hiv
0,recurrent childhood small noncleaved cell lymphoma diagnosis and forty kidneys
1,stage iiib non small cell lung cancer diagnosis and patients with history of hypertension must be well controlled less_than one hundred and fifty one hundred on stable regimen of anti hypertensive therapy
1,relapsed or refractory hodgkin lymphoma diagnosis and informed consent
1,embryonal botryoid childhood rhabdomyosarcoma diagnosis and ecog zero two
1,fallopian tube cancer diagnosis and life expectancy
1,lung cancer diagnosis and ecog zero two
0,recurrent plasma cell myeloma diagnosis and carbamazepine
1,neuroblastoma diagnosis and life expectancy
0,lung cancer diagnosis and history of pulmonary embolism or other venous thrombosis within one year of screening except for catheter related clots
0,metastatic osteosarcoma diagnosis and clinically significant gastrointestinal abnormalities that may affect absorption of investigational product including but not limited to
0,stage iv grade one follicular lymphoma diagnosis and patients who in the opinion of the treating physician are unlikely to comply with the restrictions of allogeneic stem cell transplantation based on formal psychosocial screening
1,cancer of pancreas diagnosis and hemoglobin greater_than one doc dl
1,stage iv colon cancer diagnosis and no psychiatric illness or social situation that would preclude study compliance
1,mixed anaplastic oligoastrocytoma aoa diagnosis and normal organ and marrow function as outlined in the protocol
1,adenocarcinoma of the gastroesophageal junction diagnosis and serum total bilirubin less_than doc mg dl and ast alt less_than three the institutional upper limit of normal
1,stage iv adult immunoblastic large cell lymphoma diagnosis and unrelated donor
0,nodal marginal zone cell lymphoma diagnosis and receiving any medications or substances that are strong inhibitors of cytochrome pfour hundred and fifty family three subfamily polypeptide four five cypthreeafour five
0,obstructing colorectal cancer diagnosis and suspicion of ibd
0,solid tumors diagnosis and received prior treatment with agents targeting the pdgfr ligand or receptor six weeks prior to the first dose of study medication
0,hepatocellular carcinoma diagnosis and uncontrolled blood pressure greater_than one hundred and fifty one hundred mmhg
0,recurrent childhood spinal cord neoplasm diagnosis and creatinine clearance or radioisotope gfr greater_than seventy ml min doc threem two or serum creatinine based on age as follows
1,anaplastic astrocytoma diagnosis and no overt renal hepatic cardiac or pulmonary disease
1,recurrent neuroblastoma diagnosis and mycn amplification greater than four fold increase in mycn signals as compared to reference signals regardless of age or additional biologic features
0,solid tumor diagnosis and diabetes mellitus
0,prior treatment of pancreatic cancer with chemotherapy radiation sensitizer allowed if greater_than six months has elapsed from completion
0,non small cell lung carcinoma diagnosis and serum creatinine gt doc uln uncontrolled hypercalcemia gt one doc mg dl urinary protein creatinine ratio greater_than equal_than one spot urine or clinically significant impairment of renal function estimated creatinine clearance lt forty-five ml min for patients who will receive pemetrexed
1,cervical adenosquamous carcinoma diagnosis and see disease characteristics
0,metastatic cancer diagnosis and for dose confirmation part b
0,sarcoma soft tissue diagnosis and insufficient live negative renal or bone marrow function
0,endometrial clear cell adenocarcinoma diagnosis and patients with known brain metastases
0,cancer of the urethra diagnosis and prior neoadjuvant or adjuvant systemic chemotherapy including cisplatin based is allowed provided it was completed greater than or equal to six months prior to the diagnosis of metastatic disease
0,stage iv cutaneous cell non hodgkin lymphoma diagnosis and patients with medical history of noncompliance with haart or medical therapy
1,lymphoma diagnosis and patients greater_than equal_than fifty-five but less_than equal_than sixty-five years who have performance status of zero or one and no comorbidities may receive the myeloablative regimen one at the discretion of the investigator s
0,concurrent second malignancy other than non melanoma skin cancer or cervical carcinoma in situ
0,neoplasm metastases diagnosis and patients with known liver disease
0,recurrent follicular lymphoma diagnosis and is currently participating and receiving study therapy or has participated in study of an investigational agent and received study therapy or used an investigational device within four weeks of the first dose of treatment
0,recurrent childhood lymphoblastic lymphoma diagnosis and clinically significant peripheral vascular disease
0,melanoma diagnosis and concomitant treatment with systemic corticosteroids greater than physiologic doses
1,nodal marginal zone cell lymphoma diagnosis and forced expiratory volume in one second fevone greater_than fifty
1,multiple myeloma diagnosis and ecog performance status greater_than equal_than two
1,hepatocellular carcinoma diagnosis and ability to receive oral medication
0,prostate neoplasms diagnosis and abnormal liver function
0,adenocarcinoma of the prostate diagnosis and history of major surgery within four weeks or minor surgical procedures within one week before randomization
0,contiguous stage ii grade one follicular lymphoma diagnosis and fungal pneumonia with radiological progression after receipt of amphotericin formulation or mold active azoles for greater than one month
0,cancer diagnosis and cardiomyopathy serious structural cardiac abnormalities or history of any of the following
0,head and neck cancer diagnosis and unstable angina serious uncontrolled cardiac arrhythmia active or uncontrolled infectious disorder myocardial infarction less_than equal_than six months prior to study entry
0,brain tumor diagnosis and history of surgery at the same site
1,limited disease small cell lung cancer diagnosis and patients should sign written informed consest before study entry
0,non small cell lung cancer diagnosis and history or evidence of inherited bleeding diathesis or coagulopathy with the risk of bleeding
0,cancer diagnosis and patients with contraindications to cyp and or gm csf
1,gastric cancer diagnosis and fertile patients must use effective contraception four weeks prior to during and for six months after completion of study therapy male patients must use barrier method contraception
1,mediastinal thymic large cell lymphoma diagnosis and stage iii with elevated ldh level high ldh greater_than twice the institutional upper limit of the adult normal values greater_than nxtwo any stage iv or al phase iii
0,stage multiple myeloma diagnosis and subjects with pleural effusions requiring thoracentesis or ascites requiring paracentesis
0,invasive lobular breast carcinoma diagnosis and pregnant or breast feeding patients are excluded
0,stage iia pancreatic cancer diagnosis and treatment with neoadjuvant chemotherapy or radiation therapy
0,prior anticancer treatment that would preclude study therapy
0,metastatic colorectal cancer diagnosis and major surgical procedure open biopsy or significant traumatic injury within twenty-eight days prior to treatment or anticipation of the need for major surgery during the course of the study
0,relapsed or refractory advanced cancer diagnosis and compound or device within thirty days prior to the first dose of study drug
0,stage iii childhood anaplastic large cell lymphoma diagnosis and donor
0,prostate cancer diagnosis and the above information was not intended to contain all considerations relevant to participant potential participation in clinical trial
1,primary central nervous system hodgkin lymphoma diagnosis and unstable angina pectoris
1,ovarian cancer diagnosis and fertile patients must use effective contraception during and for three months after study participation
0,neoplasms diagnosis and previous chemotherapy or radiotherapy
1,lymphoma diagnosis and renal
1,neuroblastoma diagnosis and progressive disease
0,uterine carcinosarcoma diagnosis and no intercurrent cardiac dysfunction including but not limited to any of the following
0,stage iv skin melanoma diagnosis and absolute neutrophil count less than one thousand mm three
0,ovarian serous adenocarcinoma diagnosis and patients with ctcae grade two or greater peripheral vascular disease at least brief less_than two4 hours episodes of ischemia managed non surgically and without permanent deficit
0,carcinoma non small cell lung diagnosis and therapeutic anticoagulation
0,primary peritoneal serous adenocarcinoma diagnosis and patients with history of cerebrovascular accident cva stroke transient ischemic attack tia or subarachnoid hemorrhage within six months of the first date of treatment on this study are ineligible
0,stage iiib breast cancer diagnosis and angina pectoris that requires the use of anti anginal medication
0,sarcoma diagnosis and renal failure requiring hem negative or peritoneal dialysis
0,brain tumor diagnosis and has had prior chemotherapy targeted small molecule therapy or radiation therapy within two weeks prior to study day one or who has not recovered less_than equal_than grade one or at baseline from adverse events due to previously administered agent
1,regional neuroblastoma diagnosis and doc mg dl males doc mg dl females
0,metastatic colorectal cancer diagnosis and any history of or currently known brain metastases
0,prostatic neoplasms diagnosis and ast or alt greater_than doc uln
1,osteosarcoma diagnosis and biologic anti neoplastic agent
0,patients who have received any anti cancer investigational agent in the month prior to inclusion
0,stage iii adrenocortical carcinoma diagnosis and pregnant or nursing women
0,er positive breast cancer diagnosis and assessment of lvef is done before and after trastuzumab based chemotherapy as standard of care
0,metastatic breast cancer diagnosis and history of hyperparathyroidism
0,symptomatic central nervous system cns metastasis
0,advanced malignant neoplasm diagnosis and history of allergic reactions attributed to compounds of similar chemical or biologic composition including macrolide azithromycin clarithromycin dirithromycin and erythromycin and ketolide antibiotics
0,multiple myeloma diagnosis and primary al amyloidosis
0,stage ib non small cell lung cancer diagnosis and support persons
1,stage multiple myeloma diagnosis and step ii
0,non hodgkin lymphoma diagnosis and serum creatinine greater_than doc normal
0,stage ivb verrucous carcinoma of the oral cavity diagnosis and unstable angina
0,recurrent adult diffuse small cleaved cell lymphoma diagnosis and diffusing capacity of the lung for carbon monoxide dlco less than forty predicted corrected for hemoglobin hb and or alveolar ventilation
0,stage iv adult lymphoblastic lymphoma diagnosis and donor
0,esophageal adenocarcinoma diagnosis and medical conditions such as active uncontrolled infection including hiv or cardiac disease that would make this protocol unreasonably_hazardous for the patient in the opinion of the treating physician cardiac disease may include uncontrolled high blood pressure unstable angina or serious uncontrolled cardiac arrhythmia
1,non hodgkin lymphoma or hodgkin lymphoma
0,untreated stage iii melanoma or stage iv melanoma diagnosis and patients with greater_than grade two peripheral neuropathy
0,hepatocellular cancer diagnosis and total serum calcium less_than one doc mg dl
0,differentiated thyroid cancer diagnosis and prior external beam radiation therapy to the target lesion s
1,unresectable intrahepatic cholangiocarcinoma diagnosis and albumin greater_than doc mg dl
1,recurrent refractory childhood hodgkin lymphoma diagnosis and creatinine clearance or radioisotope gfr greater_than equal_than seventy ml min doc three two or serum creatinine based on age gender as follows
0,clear cell renal cell carcinoma diagnosis and is within two weeks prior to day one nursing
1,uterine leiomyomata diagnosis and risk reducing prophylactic oophorectomy
