Classification,Summary
0,plasma cell myeloma diagnosis and patient has greater_than equal_than grade three peripheral neuropathy or grade two with pain on clinical examination during the screening period
0,anaplastic oligodendroglioma diagnosis and concurrent chemotherapy immunotherapy radiotherapy radiosurgery interferon intron allergy desensitization injections growth factors procrit_aranesp neulasta interleukins proleukin or any investigational therapeutic medication
0,metastatic breast cancer diagnosis and any severe and or uncontrolled medical conditions such as
0,metastatic cancer to liver diagnosis and if varices are identified that require intervention banding patient will not be eligible until varices adequately treated
0,cancer diagnosis and prior major surgical procedure less than twenty-eight days prior to day one of cycle one chemotherapy dosing anticipated need for major surgical procedure during the four cycle treatment period of the study
1,prostate cancer diagnosis and biologic therapy
1,relapsed solid tumors diagnosis and prior therapy
1,peripheral cell lymphoma diagnosis and patients with malabsorption or any other condition that in the opinion of the principal investigator could cause difficulty in absorption of drug
1,stage iiia non small cell lung cancer diagnosis and platelet count greater_than equal_than one hundred zero mm three
0,stage iiib ovarian cancer diagnosis and received more than two prior cytotoxic chemotherapy regimens for persistent or recurrent disease
1,all patients between the age of fifty and seventy-five years referred to the forzani macphail colorectal cancer screening centre in calgary alberta canada for colonoscopy will be considered for inclusion
1,small size posterior uveal melanoma diagnosis and life expectancy of at least six months
0,untreated childhood rhabdomyosarcoma diagnosis and patients who have received any chemotherapy excluding steroids and or radiation therapy prior to this enrollment
0,stage cutaneous cell non hodgkin lymphoma diagnosis and clinically active hepatitis b or infections note
0,metastatic colorectal cancer diagnosis and known hypersensitivity to trial drugs or hypersensitivity to any other component of the trial drugs
0,malignant adrenal gland pheochromocytoma diagnosis and inflammatory bowel disease ulcerative colitis crohn disease or other gastrointestinal conditions which increase the risk of perforation
0,advanced solid tumors diagnosis and note
1,stage iiic breast cancer diagnosis and prior documented bilateral oophorectomy or history of at least twelve months without spontaneous menstrual bleeding or have persistently postmenopausal estradiol in the past six months without menses and clinically in menopause at the judgment of the treating physician or age six0 or older with prior hysterectomy without oophorectomy or age less than six0 with prior hysterectomy without oophorectomy or in whom the status of the ovaries is unknown with documented fsh level demonstrating confirmatory elevation in the postmenopausal range for the lab
0,prior history of other malignancies except for basal cell or squamous cell carcinoma of the skin or carcinoma in situ of the cervix or breast unless disease free for greater_than five years
1,recurrent non small cell lung carcinoma diagnosis and prior treatment with anthracyclines
0,multiple myeloma diagnosis and plasmapheresis
0,metastatic cancer diagnosis and major surgical procedure open biopsy or significant traumatic injury less_than twenty-eight days before randomization
1,prostate cancer diagnosis and no renal disease
0,patients with history of curatively treated malignancy including patients with superficial bladder cancer who have not had evidence of recurrence for minimum of five years
0,stage iii childhood lymphoblastic lymphoma diagnosis and participation in clinical trials with other investigational agents not included in this trial within fourteen days of the start of this trial and within thirty days of any dose of bortezomib
1,stage iib ovarian cancer diagnosis and absolute neutrophil count anc greater_than equal_than one five hundred mcl
0,the patient has other spinal and spinal cord diseases rather than intra spinal canal tumor such as disc herniation vertebral fractures
1,cancer risk diagnosis and limited to those patients who are registered for outpatient or inpatient care at university of southern california usc norris
0,stage iia melanoma diagnosis and patients with primary or secondary immunodeficiencies
1,lymphoma diagnosis and non investigational antiretroviral and antiviral medications medications for mycobacterium_avium disease characteristics
0,recurrent grade one follicular lymphoma diagnosis and potential donors who for psychological physiological or medical reasons cannot tolerate administration of csf or apheresis
0,ovarian seromucinous carcinoma diagnosis and patients with prior treatment with anti programmed cell death pd one ant negative programmed cell death ligand pd one or anti cytotoxic lymphocyte associated protein ctla four therapeutic antibody or pathway targeting agents
1,limited stage small cell lung carcinoma diagnosis and patients must sign study specific informed consent prior to study entry
0,b cell non hodgkins lymphoma diagnosis and seizure disorder
0,uncontrolled intercurrent illness including but not limited to ongoing or active infection symptomatic congestive heart failure new york heart association class iii and iv heart failure unstable angina pectoris cardiac arrhythmia or psychiatric illness social situations that would limit compliance with study requirements or concurrent medications that alter cardiac conduction
0,pancreatic alpha cell adenoma diagnosis and anticonvulsants stable dose are allowed
1,pancreatic cancer diagnosis and tumour free margins could be achieved
0,lung carcinoma diagnosis and john wort will be excluded cypthreeafour inducing drugs should be discontinued at least two weeks prior to the first cycle of irinotecan
0,t cell lymphoma diagnosis and prior treatment with sorafenib or other agents with similar activity bevacizumab imatinib sunitinib
0,recurrent breast carcinoma diagnosis and note
1,malignant neoplasm of breast diagnosis and also participants in this situation would not be required to have additional post mastectomy radiation therapy
1,recurrent malignant mesothelioma diagnosis and no unstable angina pectoris within the past six months
1,mixed glioma diagnosis and disease recurrence progression in the cerebral hemisphere which is in at least one area of enhancement amenable to biopsy after protocol enrollment in the following locations
0,renal cancer diagnosis and male patients whose sexual partner are wocbp who are not willing to use adequate contraception during the study and for eight weeks after the end of treatment
1,pregnant or lactating woman
0,cervical carcinoma diagnosis and severe renal disease
1,stage iv prostate cancer diagnosis and white blood cell wbc greater_than equal_than two five hundred cells ul
0,recurrent or metastatic gastric cancer diagnosis and during clinical trials patient receiving of systemic chemotherapy or other clinical trials drugs or radiotherapy however it is possible that palliative radiotherapy treatment for pain relief on primary lesion after more than two weeks
0,stage ii renal cell cancer diagnosis and history of coronary artery disease or peripheral arterial disease
0,stage iii adult burkitt lymphoma diagnosis and total bilirubin greater_than equal_than two times upper limits of normal unless due to gilberts disease or nhl
0,ovarian cancer diagnosis and patients who have had bowel irradiation within six weeks
0,prostate cancer diagnosis and existence of any surgical or medical condition other than the current transplant which in the opinion of the investigator might significantly alter the absorption distribution metabolism or excretion of study medication
0,noncontiguous stage ii grade one follicular lymphoma diagnosis and co morbid condition which in the view of the investigators renders the patient at high risk for this study
0,recurrent small lymphocytic lymphoma diagnosis and single mass greater than or equal to ten cm
0,anaplastic large cell lymphoma alk positive diagnosis and patients chronically receiving drugs that are known potent cypthreeafour inhibitors within seven days prior to study enrollment including but not limited to ketoconazole itraconazole clarithromycin erythromycin ritonavir indinavir nelfinavir saquinavir delavirdine nefazodone diltiazem verapamil and grapefruit juice are not eligible the topical use of these medications if applicable two ketoconazole cream is allowed
1,recurrent adult diffuse small cleaved cell lymphoma diagnosis and quantitative or qualitative congenital platelet disorders including but not limited to congenital amegakaryocytopenia_absent radii syndrome glanzmann thrombasthenia
0,b cell lymphoma diagnosis and subject has platelet count of less than seventy-five zero
0,adenocarcinoma of the esophagus diagnosis and patients with prior history of marked intolerance to five fluoropyrimidines five fu floxuridine capecitabine five fluorocytosine flucytosine since such patients may have deficiency of dihydropyrimidine_dehydrogenase which places them at risk for severe and life threatening toxicity with five fu
1,neuroblastoma diagnosis and creatinine greater_than doc uln for age if serum creatinine is greater_than doc uln of age then creatinine clearance or radioisotope gfr must be greater_than seventy ml min doc three mtwo adequate hepatic function
0,noncontiguous stage ii adult diffuse mixed cell lymphoma diagnosis and donor
0,follicular lymphoma diagnosis and patients otherwise judged by investigator or sub investigator to be unsuitable
1,ovarian cancer diagnosis and prior biologic response modifier treatment allowed at least four weeks since prior immunotherapy at least four weeks since prior biologic therapy no concurrent epoetin_alfa chemotherapy
0,metastatic melanoma diagnosis and history of coronary revascularization or ischemic symptoms
0,melanoma diagnosis and failure to prepare vaccine that meets all quality control release criteria
0,recurrent fallopian tube cancer diagnosis and any of the following because this study involves an agent that has known genotoxic_mutagenic and teratogenic effects
1,gastrointestinal stromal tumor diagnosis and women of childbearing potential and men must agree to use accepted methods of contraception during the course of the study and at least three months after last dose of treatment
1,prostate cancer diagnosis and patients who are currently pregnant or breast feeding
0,ovarian cancer diagnosis and serious cardiac illness or medical conditions such as unstable angina pulmonary embolism or uncontrolled hypertension
0,previous or concurrent malignancy except inactive non melanoma skin cancer in situ carcinoma of the cervix or other cancer if the patient has been disease free for more than five years
1,plasmablastic lymphoma diagnosis and although not required it is encouraged that myc and bcl two be measured by immunohistochemistry ihc and clearly documented
1,poorly differentiated histology uterine papillary serous carcinoma clear cell carcinoma or carcinosarcoma is acceptable as long as the predominant metastatic component is epithelial versus sarcomatous
0,untreated metastatic pancreatic ductal adenocarcinoma diagnosis and any condition that might interfere with the patient participation in the study or in the evaluation of the study results
0,non small cell lung cancer diagnosis and currently have recently taken long acting nsaid ibuprofen less_than four hundred mg qid acceptable or aspirin greater_than three hundred and twenty-fivemg day within five days of initial pemetrexed administration
0,endometrial cancer diagnosis and patient must have negative serum or urine pregnancy test within seventy-two hours of study entry
1,squamous cell carcinoma of the oral cavity stage iv diagnosis and one
1,bone cancer diagnosis and females of childbearing potential must have negative pregnancy test less_than equal_than twenty-eight days prior to registration
1,precancerous condition diagnosis and disease characteristics
0,recurrent adult brain neoplasm diagnosis and serious or non healing wound active ulcer or untreated bone fracture
0,previous history of other cancers except cured skin and cervical carcinoma in situ
0,follicular lymphoma diagnosis and serum creatinine greater_than two institutional upper limit of normal iuln total bilirubin greater_than two iuln or ast sgot greater_than two iuln alkaline phosphatase greater_than two iuln
0,stage childhood small noncleaved cell lymphoma diagnosis and marrow donors who have increased anesthetic risk
0,breast cancer diagnosis and progressive disease on single agent trastuzumab emtansine or trastuzumab emtansine containing regimen during the parent study or before starting the extension study with the exception of patients from study tdmfour thousand
0,solid tumors diagnosis and social situations that would limit compliance with study requirements
0,recurrent grade three follicular lymphoma diagnosis and prednisone equivalent of less_than twenty mg daily is permitted in patients requiring chronic use larger doses must be discontinued greater_than equal_than seven days prior to ibrutinib initiation and are prohibited during study treatment
0,stage iia skin melanoma diagnosis and history of allergic reactions attributed to compounds that are similar to interferon alpha twob
0,metastatic breast cancer diagnosis and however patients with treated brain metastases by surgery or radiation who are stable and symptom free less_than four mg dexamethasone day for minimum period of four weeks prior to study treatment are eligible
0,early stage breast cancer diagnosis and lymphatic or vascular invasion positive
0,gastric cancer diagnosis and history of persistent neurosensory disorder including but not limited to peripheral neuropathy
0,head and neck cancer diagnosis and history of allergic reactions attributed to metformin or other agents used in study
0,stage iv adult burkitt lymphoma diagnosis and diagnosed with autoimmune disease
0,neuroendocrine tumors diagnosis and patients with an active bleeding diathesis
0,melanoma diagnosis and within one year of the screening visit receiving methadone buprenorphine hydrochloride hcl and or butorphanol tartrate within one year of screening visit unless participant has drug screen negative for other non narcotic drugs documented in past year and repeated negative within two months of screening visit multi drug abuse two or more substances in one7a and one7b within three years of screening visit if the patient historic marijuana use is deemed excessive by the principal investigator pi or medically qualified individual or is interfering with the patient life then the patient is not eligible and should not be screened
1,hodgkin lymphoma diagnosis and these stem cells may have been collected from pbsc pheresis bone marrow harvest or the combination
0,glioblastoma multiforme diagnosis and requires therapeutic anti coagulation
0,lung cancer diagnosis and history of autoimmune disease
1,recurrent mantle cell lymphoma diagnosis and females of reproductive potential must adhere to the scheduled pregnancy testing as required in the revlimid risk evaluation and mitigation_strategy rems program
0,patient has bilateral breast cancer or metastatic disease or inflammatory breast cancer
0,exceptions include basal cell carcinoma of the skin squamous cell carcinoma of the skin or in situ cervical cancer that has undergone potentially curative therapy
0,mesothelioma diagnosis and doc
1,stage testicular seminoma diagnosis and axial imaging of lymphadenopathy within six weeks of the date of rplnd
1,must have measurable disease that can be assessed using response evaluation in solid tumors recist doc defined as the presence of at least one lesion on mri or ct scan that can be accurately measured with the longest diameter of ten mm in at least one dimension
0,cancer of prostate diagnosis and surgeon who does not have access to high speed internet greater_than one thousand and twenty-four ko s
0,endometrial cancer diagnosis and has any condition that interferes with the ability of the subject to understand or comply with the requirements of the study
0,cervical adenosquamous carcinoma diagnosis and significant vascular disease aortic aneurysm history of aortic dissection
0,non hodgkin lymphoma diagnosis and pregnant or lactating
0,stomach neoplasms diagnosis and pregnancy planned pregnancy or lactation
1,recurrent adenocarcinoma of the pancreas diagnosis and two observers will be required to assess kps
1,at the same time at least four weeks before she begins lenalidomide therapy women of childbearing potential is defined as sexually mature woman who has not undergone hysterectomy or who has had menses at any time in the preceding 2four consecutive months men must agree not to father child and must use latex condom during any sexual contact with women of childbearing potential while taking lenalidomide and for four weeks after therapy is stopped even if they have undergone successful vasectomy
0,nodal marginal zone cell lymphoma diagnosis and positive serology for hepatitis hc defined as positive test for hcab
0,recurrent adult cell leukemia lymphoma diagnosis and history of brain metastases
0,bladder cancer diagnosis and ongoing cardiac dysrhythmias of nci ctcae version doc grade greater_than two
1,relapsed or refractory medulloblastoma mb part also include neuroblastoma nb ewing sarcoma es and alveolar rhabdomyosarcoma arms diagnosis and have no symptoms of cranial hypertension or convulsions within fourteen days before cycle one day one anti epileptic drugs and corticoids are allowed to control any preexisting symptoms
0,hepatocellular carcinoma diagnosis and cardiac arrhythmias requiring anti arrhythmic therapy other than beta blockers or digoxin
0,stage ib gastric cancer diagnosis and active autoimmune disorders including patients known to be human immunodeficiency virus hiv positive or those requiring chronic steroid administration excluding inhaled steroids
1,adult solid neoplasm diagnosis and fasting plasma glucose less_than one hundred and twenty mg dl
1,childhood oligodendroglioma diagnosis and alt and ast less_than three times uln
0,breast cancer diagnosis and all medical problems must be managed and controlled
1,recurrent melanoma diagnosis and surgically resected or have been treated with gamma_knife or stereotactic radiosurgery
0,non hodgkin lymphoma diagnosis and active uncontrolled cns leukemia
1,embryonal childhood rhabdomyosarcoma diagnosis and first relapse or first occurrence of disease progression
0,stage iiic rectal cancer diagnosis and abdominal masses that are not confirmed and followed by imaging techniques
0,carcinoma squamous diagnosis and active uncontrolled infection e
1,breast cancer diagnosis and endocrine therapy
1,erbbtwo positive stage iii breast cancer diagnosis and karnofsky performance status of seventy or higher
1,salivary gland squamous cell carcinoma diagnosis and no uncontrolled hypertension
1,high grade glioma diagnosis and one four cmthree
1,prostate cancer diagnosis and disease progression is defined as development of new metastatic lesions or greater_than two consecutive rises in prostate specific antigen psa over reference value
0,untreated childhood myeloid neoplasm diagnosis and enrollment may occur pending results of clinically indicated studies to exclude these conditions
0,familial adenomatous polyposis coli diagnosis and subjects who are due to undergo an anticipated colectomy within eight months of randomisation
0,neoplasm metastasis diagnosis and allergy to polysorbate eighty doxorubicin or egg lecithin
1,recurrent non small cell lung cancer diagnosis and no evidence of coagulopathy defined as pt and or ptt equal_than less_than doc uln or platelets greater_than equal_than one hundred zero
0,multiple myeloma diagnosis and patients with known cirrhosis
0,intraocular lymphoma diagnosis and donor
0,stage iv grade one follicular lymphoma diagnosis and recipient is human immunodeficiency virus hiv one positive
0,lymphoma diagnosis and patients with history of cardiac arrhythmias should have cardiac evaluation and clearance
0,stage iv breast cancer diagnosis and pregnant or lactating women of childbearing potential with either positive or no pregnancy test at baseline are excluded
1,stage iv adult diffuse large cell lymphoma diagnosis and more than four weeks since prior major surgery
0,peritoneal neoplasms diagnosis and no patients with clinically significant cardiovascular disease
0,colorectal cancer diagnosis and psychiatric disorder compromising comprehension or participation in the study
0,ovarian neoplasms diagnosis and patients who have malignancy that is not primary gynecologic malignancy
1,stage iii renal cell cancer diagnosis and an overlap between classes of therapies given concurrently will be counted as two prior treatment regimens
0,pain that is not cancer related
0,colorectal adenoma diagnosis and high bad cholesterol level low density_lipoprotein ldl greater than one hundred and seventy-five mg dl or triglyceride levels greater than six hundred mg dl
0,hormone receptor positive er positive pr positive and her negative metastatic breast cancer diagnosis and hormonal contraception methods oral injected implanted are not allowed as it cannot be ruled out that the study drug decreases the effectiveness of hormonal contraception two exually active males who are unwilling to use condom during intercourse while taking drug and for six months after stopping investigational medications and agree not father child in this period
1,stage iii lymphoepithelioma of the oropharynx diagnosis and no proteinuria
1,metastatic cancer diagnosis and gastrointestinal
1,recurrent grade two follicular lymphoma diagnosis and has not been naturally postmenopausal for at least 1two consecutive months has had menses at any time in the preceding 1two consecutive months
1,melanoma diagnosis and aspartate aminotransferase ast and alanine aminotransferase alt equal_than less_than three times institutional upper normal level ast and alt equal_than less_than five times institutional upper normal level if there is evidence of liver metastasis
0,urogenital neoplasms diagnosis and serious or uncontrolled co existent non malignant disease including active and uncontrolled infection
0,hepatocellular carcinoma diagnosis and patients who disagree to participate in this study
0,stage iva squamous cell carcinoma of the oropharynx diagnosis and history of allergic reactions attributed to compounds of similar chemical or biologic composition to sorafenib docetaxel cisplatin
0,other malignancy except nonmelanoma skin cancer unless disease free for the past three years
1,splenic marginal zone lymphoma diagnosis and normal karyotype who are fltthree_itd negative and npmone positive in the absence of kit mutations
1,neoplasms advanced or metastatic diagnosis and aspartate aminotransferase ast and alanine aminotransferase alt less_than doc uln
0,other malignancy except completely excised basal or squamous cell carcinoma of the skin or completely treated carcinoma in situ of the cervix
0,adult anaplastic astrocytoma diagnosis and patients who are known to be human immunodeficiency virus hiv positive and are receiving combination antiretroviral therapy are ineligible
0,refractory extranodal marginal zone lymphoma of mucosa associated lymphoid tissue diagnosis and major surgery within fourteen days before enrollment
1,unspecified childhood solid tumor protocol specific diagnosis and patient characteristics
1,stage iv breast cancer diagnosis and if subject is on an investigational drug the drug must be cleared from the body over period of four weeks
0,recurrent childhood brain stem glioma diagnosis and patients who are receiving drugs that are strong inducers or inhibitors of cytochrome pfour hundred and fifty family three subfamily polypeptide four cypthreeafour
0,bone tumor diagnosis and known reaction to gd dtpa
0,hepatocellular carcinoma diagnosis and prior uncontrolled life threatening malignancy within the six months
1,stage ii rectal cancer diagnosis and patients with history of hypertension must have blood pressure less_than one hundred and fifty ninety mm hg and be on stable regimen of antihypertensive therapy
0,mesothelioma diagnosis and patients will be ineligible if the white blood cell wbc is less than three thousand microliters or platelets are less than seventy-five zeroml mm three
0,stage ivb squamous cell carcinoma of the paranasal sinus and nasal cavity diagnosis and john wort hypericum_perforatum or rifampin rifampicin and or rifabutin within twenty-eight days before randomization
1,breast cancer diagnosis and lesions on chest ray are allowed provided they are clearly defined and surrounded by aerated lung
0,clear cell carcinoma diagnosis and prior allogeneic hematopoietic stem cell transplant
1,subjects with recurrent disease stage iii iv diagnosis of epithelial ovarian cancer fallopian tube cancer or primary peritoneal carcinoma
1,lung cancer diagnosis and at least two weeks since prior thoracic or other major surgery and recovered
0,other current drug therapy for the cancer
0,melanoma skin diagnosis and no autoimmune disorders or conditions of immunosuppression
0,trichilemmocarcinoma diagnosis and hiv positive patients on combination antiretroviral therapy are ineligible appropriate studies will be undertaken in patients receiving combination antiretroviral therapy when indicated
